CN,CN,P,A ,Method for identifying default risks of P2P network lending borrowers,"The invention provides a method for identifying default risks of P2P network lending borrowers. The method comprises the following steps of: 1, acquiring P2P lending application data information; 2, preprocessing data to obtain lending description text information; 3, carrying out feature extraction on the lending description text information; 4, identifying a default risk of P2P network lending through combining objective basic information features of a borrower and the lending description text information by using a support vector machine classification method; and 5, carrying out SVM kernelfunction parameter optimization by adoption of ten-fold cross validation. According to the method for identifying default risks of P2P network lending borrowers, the default identification correctness is improved by 10% or more than 10% and the highest default identification correctness is 73.42%.","A kind of 1. method of identification P2P network loan borrower's default risks, it is characterised in that include the following steps：Step 1, gathers P2P loan application data messages；Step 2, pre-processes data, obtains description text message of borrowing money；Step 3, to borrowing money, description text message carries out feature extraction, and the text feature of extraction includes：(1) text size, (2) Readability, (3) positive negative emotion, (4) speech intensity, (5) promise breaking text feature word frequency variable,Step 4, using support vector machine classification method, with reference to the objective base information characteristics of borrower, and description of borrowing money is literary Default risk of this information to P2P network loans is identified, including step：First, the data in data set are pressed into borrower Refund behavior be divided into two classes：Refund, break a contract as scheduled, then, build bis- graders of SVM, call the training letter of support vector machines It is several that data are trained；Step 5, SVM kernel functional parameter optimizations are carried out using ten folding cross validations：Data set is randomly divided into 10 parts, takes 9 every time Part does the nicety of grading of validation test accuracy rate testing model, assesses parameter as training set training grader, remaining portion Performance, calculate Prediction sum squares, the above process is repeated 10 times, finally the Prediction sum squares of 10 times are averaged again The alternatively foundation of optimal models structure.",9.0,2017-11229175,2017-11-29,108009911,2018-05-08,,,SHANGHAI PUBLISHING AND PRINTING COLLEGE,CHEN QUN | ZONG LIYONG,,,,0.0,,0.0,,CN108009911A,1,,,,8418192006520,"['p2p network lending borrowers', 'identifying default risks', 'method']","['acquiring p2p lending application data information', 'combining objective basic information features', 'obtain lending description text information', 'support vector machine classification method', 'lending description text information', 'p2p network lending borrowers', 'svm kernelfunction parameter optimization', 'highest default identification correctness', 'p2p network lending', 'default identification correctness', 'fold cross validation', 'identifying default risks', 'preprocessing data', 'default risk', 'method comprises', 'invention provides', 'following steps', 'feature extraction', '42 %.', 'method', 'identifying', 'using', 'ten', 'improved', 'carrying', 'borrower', 'adoption', 'according', '73', '5', '4', '3', '2', '10', '1']"
CN,CN,P,B ,P2P (peer-to-peer) network lending risk prediction system based on text analysis,"The invention relates to P2P network lending risk prediction systems, in particular to a P2P network lending risk prediction system based on text analysis. The P2P network lending risk prediction system based on text analysis comprises a platform data acquisition module, a text feature extraction module, a risk prediction model building and training module and a risk prediction module. The text feature extraction module is used for performing word segmentation on a loan description text acquired by the platform data acquisition module, removing words having no actual meaning according to a stop word list and extracting emotional characteristics S, theme characteristics T and readability characteristics R in the loan description text; and then a risk prediction model is built and trained; finally the emotional characteristics S, the theme characteristics T and the readability characteristics R in the new loan list and user basic data, user credit data and loan list data in the platform data acquisition module are used as input variables to be input into the risk prediction model to obtain a risk prediction result. The P2P network lending risk prediction system based on text analysis is applicable to P2P network lending risk prediction.","1. a kind of P2P network loan Risk Forecast Systems based on text analyzing, it is characterised in that the system includes：Platform data acquisition module, for the user data and transaction data in automatic data collection P2P network loan platforms, including with Family master data, user credit data, loaning bill table data, borrow money description text, loaning bill repayment situation；Text character extraction module, for obtaining in platform data acquisition module "" description text of borrowing money "" and carrying out word segmentation simultaneously The word of no physical meaning is removed according to word list is disabled, while is responsible for the semantic feature that extraction loaning bill description text includes, Including affective characteristics S, theme feature T and readable feature R；Risk forecast model is built, training module, for building and training risk forecast model；Risk profile module, for predicting, exporting the risk situation of new loaning bill list.",5.0,2015-10076663,2015-02-12,104616198,2015-05-13,104616198,2018-01-26,HARBIN INSTITUTE OF TECHNOLOGY,YE QIANG | GUO LEI | ZHANG ZIQIONG | ZHANG ZILI,,,,4.0,CN103886501B  | CN103646343A | CN103345688A | CN102819576A,0.0,,CN104616198B,1,,,,8418051014345,"['network lending risk prediction system based', 'text analysis', 'peer', 'p2p']","['p2p network lending risk prediction system based', 'p2p network lending risk prediction systems', 'p2p network lending risk prediction', 'risk prediction model building', 'platform data acquisition module', 'text feature extraction module', 'loan description text acquired', 'risk prediction model', 'risk prediction module', 'risk prediction result', 'loan description text', 'loan list data', 'user credit data', 'user basic data', 'new loan list', 'stop word list', 'performing word segmentation', 'actual meaning according', 'text analysis comprises', 'readability characteristics r', 'extracting emotional characteristics', 'text analysis', 'training module', 'emotional characteristics', 'theme characteristics', 'removing words', 'invention relates', 'input variables', 'input', 'used', 'trained', 'particular', 'obtain', 'finally', 'built', 'applicable']"
CN,CN,P,A ,Loan system based on P2P (person-to-person or peer-to-peer) financing platform,"The invention discloses a loan system based on a P2P (person-to-person or peer-to-peer) financing platform. The system includes an application unit, a server, a rating unit, an information acquisitionunit, a limit monitoring unit, an artificial examination and verification unit, a repayment monitoring unit, a database, a loaning and repayment unit, an information uploading unit, a reminding and money urging unit and a credit investigation system. The application unit, the repayment monitoring unit, the limit monitoring unit and the rating unit are all connected with the server. The artificialexamination and verification unit is connected with the server. According to the system, automatic evaluation on a credit situation and a loan rating of a user can be realized through arrangement ofthe information acquisition unit, the credit investigation system and the rating unit; and carrying our further confirmation through the artificial examination and verification unit when a loan moneyamount of the user is greater than a set value can be realized through arrangement of the limit monitoring unit, loaning will be carried out only after confirmation is successful, and occurrence of acase where a large-amount loan limit is given to the user due to occurrence of a system rating error or a case where partial factors are not taken into account and losses brought thereby to the platform are prevented.","A kind of 1. loan system based on P2P financing platforms, it is characterised in that including application unit, server, grading unit, Information acquisition unit, amount monitoring unit, manual examination and verification unit, refund monitoring unit, database, release money unit, in information Leaflet member, prompting and prompt member, credit investigation system；Wherein, the application unit, refund monitoring unit, amount monitoring unit and grading unit are connected with server；Wherein, the manual examination and verification unit is connected with server；Wherein, the server and unit of making loans, information uploading unit, prompting and prompt member, database and acquisition of information list Member is connected；Wherein, described information acquiring unit is connected with grading unit；Wherein described information acquiring unit and information uploading unit is connected by network communication protocol and credit investigation system.",10.0,2017-10846129,2017-09-19,107609973,2018-01-19,,,"HEFEI INZYME INFORMATION TECHNOLOGY CO., LTD.",ZHAO QIFENG | HUANG MINGMING | HOU LIFENG | LIU SONG | FU QIANG,,,,0.0,,0.0,,CN107609973A,1,,,,8418041010742,"['loan system based', 'financing platform', 'person', 'peer', 'p2p']","['arrangement ofthe information acquisition unit', 'information uploading unit', 'losses brought thereby', 'money urging unit', 'limit monitoring unit', 'amount loan limit', 'repayment monitoring unit', 'loan system based', 'credit investigation system', 'system rating error', 'information acquisitionunit', 'repayment unit', 'rating unit', 'loan rating', 'verification unit', 'application unit', 'loan moneyamount', 'credit situation', 'system includes', 'set value', 'partial factors', 'invention discloses', 'automatic evaluation', 'artificial examination', 'user due', 'financing platform', 'arrangement', 'system', 'user', 'platform', 'taken', 'successful', 'server', 'reminding', 'realized', 'prevented', 'person', 'peer', 'p2p', 'occurrence', 'loaning', 'large', 'greater', 'given', 'database', 'connected', 'confirmation', 'case', 'carrying', 'carried', 'artificialexamination', 'account', 'according', 'acase']"
CN,CN,P,A ,Method and system for facing P2P platform operation risk assessment,"The present invention discloses a method and system for facing P2P platform operation risk assessment. The method comprises: obtaining operation data of a P2P network lending platform, performing data preprocessing, and cleaning out information which is not correlated with the P2P network lending platform or collected error information; performing selection through the fine-grained time window, and reflecting changing of the P2P network lending operation condition; performing data storage after cleaning; performing feature selection, and employing the mode of calculation of information gain to select the most correlation feature; determining one set of weight coefficients of the platform according to the risk indexes of the platform; and finally according to the obtained weight coefficients, calculating and confirming the operation risk index of the P2P platform in each time window. The method and system for facing P2P platform operation risk assessment can assess the changing condition of the operation risk of the lending platform to reflect the platform development and the operation trend of the network platform in a long-term phase, provide reference for investors and have wide technology and market application value.","1. a kind of appraisal procedure towards P2P network loan platform operations risks, it is characterised in that described method includes following Step：(1) operation data of P2P network loan platforms is obtained；(2) data prediction, the mistake letter for washing some information incoherent with P2P network loan platforms or being collected into Breath；(3) chosen by fine-grained time window, to reflect the change of P2P network loan traffic-operating periods；(4) data after cleaning are preserved；(5) Feature Selection：In training set, for multiple features of P2P network loan platforms, by the way of information gain is calculated Choose maximally related feature；(6) to each time window t, there is feature { x1,x2,…,xnN feature is shared, if the risk index of platform is R,The characteristic value of the attribute in t-th of time window is represented, it can thus be concluded that the weight coefficient of one group of platform； (7) according to the above-mentioned weight coefficient tried to achieve, calculate and confirm the operations risks index of the P2P platforms each time window Nei.",7.0,2017-10396915,2017-05-31,107423878,2017-12-01,,,NANJING UNIVERSITY OF POSTS AND TELECOMMUNICATIONS,SUN GUOZI | LIU PAN | LI HUAKANG | JIA XUESONG,,,,0.0,,0.0,,CN107423878A,1,,,,8417491010704,"['facing p2p platform operation risk assessment', 'system', 'method']","['facing p2p platform operation risk assessment', 'p2p network lending operation condition', 'p2p network lending platform', 'operation risk index', 'obtaining operation data', 'present invention discloses', 'market application value', 'determining one set', 'performing data storage', 'performing data preprocessing', 'obtained weight coefficients', 'grained time window', 'collected error information', 'performing feature selection', 'p2p platform', 'operation risk', 'network platform', 'lending platform', 'operation trend', 'changing condition', 'risk indexes', 'performing selection', 'weight coefficients', 'time window', 'platform development', 'platform according', 'correlation feature', 'wide technology', 'term phase', 'reflecting changing', 'provide reference', 'information gain', 'finally according', 'method comprises', 'platform', 'information', 'method', 'system', 'select', 'reflect', 'mode', 'long', 'investors', 'fine', 'employing', 'correlated', 'confirming', 'cleaning', 'calculation', 'calculating', 'assess']"
CN,CN,P,A ,Intelligent preprocessing tool and method applied to mass P2P network loan financial data,"The invention discloses an intelligent preprocessing tool and method applied to mass P2P network loan financial data. According to the invention, accurate and efficient preprocessing can be performed on mass P2P network loan financial data before being stored into a standard financial service database, and the accuracy and validity of the data are ensured, so that an effective monitoring mechanism for a P2P network loan platform is built, and supervision for the P2P network loan platform is effectively enhanced. Preprocessing comprises that validity and integrity checking rules are established so as to realize checking for the data before getting into the database; data classification, data deduplication, data correction, data conversion and state calculation are performed so as to realize processing for the data before getting into the database; and finally, the data is loaded into the standard financial service database.","1. one kind melts data intelligence preprocess method applied to magnanimity P2P net monetary allowances, it is characterised in that data access message queue System, carries out data prediction, with the role of consumer, the consumption data from message queue, carries out integrality and validity is tested Card, if checking does not pass through, is transferred to dealing of abnormal data sub-process, and borrows platform return error code to net, if the verification passes, Processing sub-process is transferred to, storage pre-treatment is carried out, data classification, data deduplication, data correction, data conversion, state meter is carried out Calculate, data are loaded, most net borrows finance data and is loaded into internet financial business storehouse at last.",7.0,2017-10392181,2017-05-27,107220892,2017-09-29,,,"NATIONAL COMPUTER NETWORK AND INFORMATION SECURITY MANAGEMENT CENTER | BEIJING SCISTOR TECHNOLOGIES CO., LTD.",MA XIUJUAN | MAO HONGLIANG | WANG XIUWEN | SU MURAN | ZHANG LUCHEN | WU ZHEN | LI YANYU | TANG JIQIANG | XU XIAOLEI | LI CHUANHAI | SU ZHIJIAN | XIE MING,,,,0.0,,0.0,,CN107220892A,1,,,,8417401004297,"['mass p2p network loan financial data', 'intelligent preprocessing tool', 'method applied']","['mass p2p network loan financial data', 'p2p network loan platform', 'standard financial service database', 'effective monitoring mechanism', 'integrity checking rules', 'intelligent preprocessing tool', 'realize checking', 'data deduplication', 'data correction', 'data conversion', 'data classification', 'preprocessing comprises', 'efficient preprocessing', 'state calculation', 'realize processing', 'method applied', 'effectively enhanced', 'invention discloses', 'database', 'data', 'invention', 'validity', 'supervision', 'stored', 'performed', 'loaded', 'getting', 'finally', 'established', 'ensured', 'built', 'accurate', 'accuracy', 'according']"
CN,CN,P,A ,P2P lending borrower credit risk evaluation device,"The invention discloses a P2P lending borrower credit risk evaluation device, which comprises a data acquisition module, an index system construction module, a data processing module, an evaluation model construction module and an evaluation model application module, wherein the data acquisition module is used for acquiring original data for evaluating the credit risk of a P2P lending borrower; the index system construction module is used for constructing a P2P lending borrower credit risk evaluation index system; the data processing module is used for carrying out missing value processing, outlier processing and data normalization processing on the acquired original data in combination of the constructed P2P lending borrower credit risk evaluation index system; the evaluation model construction module is used for constructing a P2P lending borrower credit risk evaluation model through a machine learning algorithm; and the evaluation model application module is used for using the constructed P2P lending borrower credit risk evaluation model to quantize and evaluate the P2P lending borrower credit risk. Through the technical scheme disclosed by the invention, more accurate and more efficient evaluation on a P2P lending default client can be carried out.","1. a kind of P2P nets borrow the device of borrower's assessing credit risks, it is characterised in that described device includes：Data acquisition module, the initial data that P2P nets borrow borrower's credit risk is assessed for gathering；Index system establishment module, borrower's assessing credit risks index system is borrowed for setting up P2P nets；Data processing module, borrows borrower's assessing credit risks index system, by the original collected for combining the P2P built nets Beginning data carry out missing values processing, outlier processing and data normalized；Assessment models build module, and borrower's Credit Risk Assessment Model is borrowed for building P2P nets by machine learning algorithm；Assessment models application module, is borrowed money for being borrowed using the P2P nets loan borrower's Credit Risk Assessment Model built to P2P nets People's credit risk is quantified and assessed.",9.0,2017-10361864,2017-05-19,107194803,2017-09-22,,,NANJING TECH UNIVERSITY,LIANG XUECHUN | PAN DENG | XIA MEIJUAN,,,,0.0,,0.0,,CN107194803A,1,,,,8417391004526,['p2p lending borrower credit risk evaluation device'],"['constructed p2p lending borrower credit risk evaluation index system', 'constructed p2p lending borrower credit risk evaluation model', 'p2p lending borrower credit risk evaluation index system', 'p2p lending borrower credit risk evaluation device', 'p2p lending borrower credit risk evaluation model', 'p2p lending borrower credit risk', 'index system construction module', 'p2p lending default client', 'evaluation model construction module', 'evaluation model application module', 'p2p lending borrower', 'credit risk', 'data acquisition module', 'data processing module', 'technical scheme disclosed', 'machine learning algorithm', 'acquiring original data', 'acquired original data', 'missing value processing', 'data normalization processing', 'efficient evaluation', 'outlier processing', 'invention discloses', 'invention', 'wherein', 'using', 'used', 'quantize', 'evaluating', 'evaluate', 'constructing', 'comprises', 'combination', 'carrying', 'carried', 'accurate']"
CN,CN,P,A ,Automatic verification method for P2P (Peer-to-Peer) lending data,"The invention discloses an automatic verification method for P2P (Peer-to-Peer) lending data. The method comprises the following steps that: S1: carrying out data accessing; S2: carrying out automatic auditing on the data accessing; S3: carrying out data API (Application Program Interface) automatic accessing; and S4: finishing automatic data verification. By use of the method, the multiple verification of the data is automatically carried out so as to be safe and intelligent. The method is high in practicality and has a wide application prospect.","1. a kind of P2P nets borrow datamation checking method, including following steps：Step one：Data accessBy the data transfer of internet financial company to center, stored；Step 2：Data access automation examination ＆ verificationDuring internet financial company data access, the internet financial company number that system WEB rear end is formulated according to center Quantity is reported according to access criteria programming count business data, whether the data field that automatic detection enterprise pushes meets the requirements, number Whether normal according to associating, whether field is complete；The data automatic feedback accessed to internet financial company, if not meeting specification, is adjusted by WEB websites and api interface Examination information clearly feeds back to enterprise's details, and the data of oneself are corrected according to feedback information is self-service by enterprise, until meeting enterprise Untill data access specification；Step 3：Data API automation accessesAutomatic test and checking are carried out to enterprise's access data；Step 4：Automation data is completed to veritifyComplete after automation data veritification, the data loading of the internet financial company of access is passed through there is provided system manager WEB modes are increased newly to enterprise's access information, are changed, delete attended operation.",3.0,2017-10391332,2017-05-27,107194804,2017-09-22,,,"NATIONAL COMPUTER NETWORK AND INFORMATION SECURITY MANAGEMENT CENTER | BEIJING SCISTOR TECHNOLOGIES CO., LTD.",MAO HONGLIANG | WANG XIUWEN | WU ZHEN | LI YANYU | XU XIAOLEI | TANG JIQIANG | MA XIUJUAN | ZHANG LUCHEN | SU MURAN | LI CHUANHAI | XUE JINHAI | XIE MING,,,,0.0,,0.0,,CN107194804A,1,,,,8417391005836,"['automatic verification method', 'lending data', 'peer', 'p2p']","['finishing automatic data verification', 'wide application prospect', 'application program interface', 'automatic verification method', 'multiple verification', 'automatic auditing', 'automatic accessing', 'lending data', 'data api', 'data accessing', 'method comprises', 'invention discloses', 'following steps', 'automatically carried', 'data', 'method', 'use', 'safe', 's4', 's3', 's2', 's1', 'practicality', 'peer', 'p2p', 'intelligent', 'high', 'carrying']"
