Country Code,DB Name,Patent/Utility,Kind Code,Title,Abstract,\,No. of Claims,Application Number,Application Date,Unexamined Pub. Number,Unexamined Pub. Date,Granted Number,Granted Date,Applicant,Inventor,Priority Number,Priority Country,Priority Date,No. of Citation Reference (B1),Citation Reference (B1),No. of Forward Reference (F1),Forward Reference (F1),WIPS Family (Appl. Base),No. of WIPS Family (Appl. Base),"Status[KR,JP,EP]",Status[US],"Current Applicant[KR,JP,US]",WIPSGLOBAL KEY,Title(Keyword),Abstract(Keyword)
US,US,P,A1,Implementation of a Service Platform for an Online Peer-to-Peer (P2P) Lending Transaction,"Disclosed is a system and method for implementing a service platform to provide one or more services for an online loan transaction through an instance of a service facilitator engine. The services provided by the service facilitator engine enhance the user's experience when engaged in an online loan transaction or online P2P lending transaction. Further, the service facilitator engine ensures a safe and secure platform for transferring the loan amount to the registered borrower. The service platform tracks the repayment schedule of the registered borrower and credits rating based on the tracking information. Based on the credit rating of the registered borrower, registered lenders can authorize the registered borrowers to avail the loan facility.","1. A method for implementing a service platform to provide at least one service through an instance of a service facilitator engine after establishing an online loan transaction to enhance user's experience while engaged in said online loan transaction within a network, wherein the method comprises of: a) establishing said online loan transaction between at least one registered lender and at least one registered borrower based on the terms and conditions agreement accepted between said at least one registered lender and said at least one registered borrower;b) creating an instance of said service facilitator engine for said online loan transaction established between said at least one registered lender and said at least one registered borrower;c) activating said at least one service offered by said service facilitator engine to said at least one registered lender after transferring the loan amount to said at least one registered borrower as per the agreement decided for said online loan transaction; andd) availing at least one service provided by said service facilitator engine that is created for said online loan transaction.",10.0,14/476743,2014-09-04,2016-0071206,2016-03-10,,,Alexander Danieli,Alexander  Danieli,,,,0.0,,0.0,,US2016-0071206A1,1,,,,5416010004721,"['service platform', 'lending transaction', 'online peer', 'peer', 'p2p', 'implementation']","['online p2p lending transaction', 'service facilitator engine ensures', 'service facilitator engine enhance', 'service facilitator engine', 'online loan transaction', 'service platform tracks', 'credits rating based', 'service platform', 'credit rating', 'secure platform', 'loan facility', 'loan amount', 'tracking information', 'repayment schedule', 'registered lenders', 'registered borrowers', 'registered borrower', 'provide one', 'services provided', 'based', 'services', 'user', 'transferring', 'system', 'safe', 'method', 'instance', 'implementing', 'experience', 'engaged', 'disclosed', 'avail', 'authorize']"
US,US,P,A1,"BENEFICIARY INITIATED P2P, P2B PAYMENT MODEL","A system and method that allows a Payee to request payment from a Payor is disclosed. The system allows the Payee to issue an invoice in electronic form detailing the payment request to the Payor. The system further allows the Payor to pay the invoice using a suitable payment means, such as a credit card, without requiring any infrastructure investment on the part of the Payee. Finally, the system does not require that the Payee receive funds from the Payor in a specific account that is associated with the system. The system allows the Payee to receive their funds in any account specified by the Payee.","1. A method of issuing an invoice and receiving payment comprising: receiving from a first user an invoice requesting a payment from a second user, wherein the invoice contains contact information for the second user; sending the invoice to the second user, wherein sending the invoice includes providing instructions for paying the invoice using a transaction account associated with the second user; requesting funds from an issuer of the transaction account associated with the second user, wherein the funds are drawn from an account associated with the second user's transaction account; receiving funds from the issuer of the transaction account associated with the second user; and transferring the received funds to an issuer of a transaction account specified by the first user, wherein the funds are deposited to the transaction account specified by the first user.",18.0,12/425046,2009-04-16,2010-0082466,2010-04-01,,,,Mark Carlson | Surendra Keshan,,,,0.0,,1.0,US10078832B2,AU2009296472A1 | BRPI0919115A2 | CA2738497A1 | US2010-0082466A1 | US2010-0082467A1 | US61/100595 | WOWO2010-036863A2,7,,,,5410013004943,"['p2b payment model', 'beneficiary initiated p2p']","['electronic form detailing', 'suitable payment means', 'payee receive funds', 'request payment', 'payment request', 'without requiring', 'specific account', 'infrastructure investment', 'credit card', 'account specified', 'invoice using', 'system allows', 'receive', 'payee', 'funds', 'system', 'invoice', 'allows', 'require', 'payor', 'pay', 'part', 'method', 'issue', 'finally', 'disclosed', 'associated']"
PCT,PCT,P,A1,SYSTEM FOR MANAGING P2P LENDING FUND BY FINANCIAL INSTITUTION,"A system for managing a P2P lending fund by a financial institution according to the present invention comprises: an investor ledger management portion for receiving an investor list of investors (the investor list includes at least one selected from the investment management number, name, resident's registration number, contact, address, and designated withdrawal account number of the investors) from a P2P platform that has made a fund management contract with the financial institution, and generating and managing an investor ledger according to the investment management number of the investors; a loan payment management portion configured such that, upon receiving a fundraising matching list of investors who have purchased a right to collect the principal and interest by investing in a lending product corresponding to a lending contract, from the P2P platform, and upon receiving a borrower lending ledger information generated by a money lender according to a lending contract between the borrower and the money lender under mediation of the P2P platform, the loan payment management portion transfers loan to the account of the borrower on the basis of the lending ledger; and a lending ledger management portion for matching and managing investor ledges of investors included in the lending ledger and the fundraising matching list. The system according to the present invention may be characterized in that the money lender makes a lending contract with the borrower under mediation of the P2P platform, generates a lending ledger, and registers selling of the right to collect the principal and interest in the P2P platform, and the P2P platform sells the right to collect the principal and the interest corresponding to an investment application of the investors to the investors.",,,PCT-KR2018-002216,2018-02-22,WO2018-155937,2018-08-30,,,"JB FINANCIAL CO., LTD.","CHOI, Sue Yeol",10-2017-0025090 | 10-2017-0079461,KR | KR,2017-02-24 | 2017-06-23,,,,,KR10-2017-0025090 | KR10-2018-0098105A | WOWO2018-155937A1,3,,,,6018035003468,"['managing p2p lending fund', 'financial institution', 'system']","['loan payment management portion transfers loan', 'loan payment management portion configured', 'borrower lending ledger information generated', 'lending ledger management portion', 'investor ledger management portion', 'designated withdrawal account number', 'investment management number', 'fund management contract', 'investor ledger according', 'present invention may', 'present invention comprises', 'least one selected', 'p2p lending fund', 'lending product corresponding', 'investor list includes', 'money lender makes', 'p2p platform sells', 'money lender according', 'managing investor ledges', 'financial institution according', 'fundraising matching list', 'lending ledger', 'lending contract', 'investor list', 'money lender', 'p2p platform', 'registration number', 'financial institution', 'investment application', 'system according', 'registers selling', 'interest corresponding', 'upon receiving', 'investors included', 'borrower', 'account', 'matching', 'managing', 'system', 'receiving', 'investors', 'interest', 'right', 'resident', 'purchased', 'principal', 'name', 'mediation', 'made', 'investing', 'generating', 'generates', 'contact', 'collect', 'characterized', 'basis', 'address']"
PCT,PCT,P,A1,P2P INVESTMENT INTERMEDIATING MATCHING SYSTEM,"The present invention provides a peer-to-peer investment intermediating matching system, which resolves a problem of conventional inventions, and issues a bond certificate in the form of a virtual currency with respect to an investment of an investor and then matches investment requirements of the investor and loan requirements of a debtor so as to intermediate the investment, and, when an investment withdrawal and the like is required within a period, searches for and matches investment requirements between investors and then transfers bonds in the form of a bond transfer through the virtual currency, so as to enable the investment to be freely withdrawn.",,,PCT-KR2017-008817,2017-08-14,WO2018-038446,2018-03-01,,,"KIM, Sinae | KIM, Keonho","KIM, Sinae | KIM, Keonho",10-2016-0108019,KR,2016-08-24,,,,,KR10-1842276B1 | KR10-1880734B1 | KR10-1880736B1 | KR10-1880738B1 | KR10-1880740B1 | KR10-1880746B1 | KR10-1880749B1 | KR10-1902732B1 | KR10-1902733B1 | KR10-1902734B1 | KR10-1902735B1 | KR10-1902736B1 | KR10-1902737B1 | WOWO2018-038446A1,14,,,,6018009003018,['p2p investment intermediating matching system'],"['peer investment intermediating matching system', 'present invention provides', 'matches investment requirements', 'investment withdrawal', 'loan requirements', 'virtual currency', 'transfers bonds', 'required within', 'freely withdrawn', 'conventional inventions', 'bond transfer', 'bond certificate', 'peer', 'investment', 'searches', 'respect', 'resolves', 'problem', 'period', 'like', 'issues', 'investors', 'investor', 'intermediate', 'form', 'enable', 'debtor']"
PCT,PCT,P,A1,CREDIT PAYMENT METHOD AND DEVICE BASED ON MOBILE TERMINAL P2P,"A credit payment method and device based on a mobile terminal P2P. The method comprises: receiving transaction information sent by a transaction terminal (S310); generating transaction response information according to the transaction information, and sending the transaction response information to the transaction terminal (S320); receiving money deducting acceptance request information, sent by the transaction terminal, about a current payment transaction (S330); generating, according to the money deducting acceptance request information and the transaction response information, an application private key generation payment authority permission in a mobile terminal (S340); and sending the payment authority permission to the transaction terminal (S350). When a user opens a payment application, the off-line credit payment of a transaction terminal can be completed by using a mobile terminal, so that the payment transaction can be completed quickly and safely.",,,PCT-CN2017-071251,2017-01-16,WO2017-128975,2017-08-03,,,ALIBABA GROUP HOLDING LIMITED,"CHEN, Xing | WANG, Lei | LAN, Jie",2016-10049675,CN,2016-01-25,,,,,CN106997527A | SG11201806344VA | TW201730819A | WOWO2017-128975A1,4,,,,6017031001127,"['mobile terminal p2p', 'credit payment method', 'device based']","['s320 ); receiving money deducting acceptance request information', 'application private key generation payment authority permission', 's310 ); generating transaction response information according', 'money deducting acceptance request information', 'receiving transaction information sent', 'payment authority permission', 'transaction response information', 's330 ); generating', 'current payment transaction', 'line credit payment', 'credit payment method', 'transaction information', 'mobile terminal p2p', 'payment application', 's340 );', 'payment transaction', 'transaction terminal', 'mobile terminal', 'method comprises', 'user opens', 's350 ).', 'device based', 'according', 'completed quickly', 'sent', 'completed', 'using', 'sending', 'safely']"
PCT,PCT,P,A2,"NEW BENEFICIARY INITIATED P2P, P2B PAYMENT MODEL","A system and method that allows a Payee to request payment from a Payor is disclosed. The system allows the Payee to issue an invoice in electronic form detailing the payment request to the Payor. The system further allows the Payor to pay the invoice using a suitable payment means, such as a credit card, without requiring any infrastructure investment on the part of the Payee. Finally, the system does not require that the Payee receive funds from the Payor in a specific account that is associated with the system. The system allows the Payee to receive their funds in any account specified by the Payee.","1. A method of issuing an invoice and receiving payment comprising: receiving from a first user an invoice requesting a payment from a second user, wherein the invoice contains contact information for the second user; sending the invoice to the second user, wherein sending the invoice includes providing instructions for paying the invoice using a transaction account associated with the second user; requesting funds from an issuer of the transaction account associated with the second user, wherein the funds are drawn from an account associated with the second user's transaction account; receiving funds from the issuer of the transaction account associated with the second user; and transferring the received funds to an issuer of a transaction account specified by the first user, wherein the funds are deposited to the transaction account specified by the first user.",,PCT-US2009-058327,2009-09-25,WO2010-036863,2010-04-01,,,VISA INTERNATIONAL SERVICE ASSOCIATION,"CARLSON, Mark | KESHAN, Surendra",61/100595 | 12/425046,US | US,2008-09-26 | 2009-04-16,,,,,AU2009296472A1 | BRPI0919115A2 | CA2738497A1 | US2010-0082466A1 | US2010-0082467A1 | US61/100595 | WOWO2010-036863A2,7,,,,6010013003737,"['new beneficiary initiated p2p', 'p2b payment model']","['electronic form detailing', 'suitable payment means', 'payee receive funds', 'request payment', 'payment request', 'without requiring', 'specific account', 'infrastructure investment', 'credit card', 'account specified', 'invoice using', 'system allows', 'receive', 'payee', 'funds', 'system', 'invoice', 'allows', 'require', 'payor', 'pay', 'part', 'method', 'issue', 'finally', 'disclosed', 'associated']"
PCT,PCT,P,A3,"NEW BENEFICIARY INITIATED P2P, P2B PAYMENT MODEL","A system and method that allows a Payee to request payment from a Payor is disclosed. The system allows the Payee to issue an invoice in electronic form detailing the payment request to the Payor. The system further allows the Payor to pay the invoice using a suitable payment means, such as a credit card, without requiring any infrastructure investment on the part of the Payee. Finally, the system does not require that the Payee receive funds from the Payor in a specific account that is associated with the system. The system allows the Payee to receive their funds in any account specified by the Payee.",,,PCT-US2009-058327,2009-09-25,WO2010-036863,2010-04-01,,,VISA INTERNATIONAL SERVICE ASSOCIATION,"CARLSON, Mark | KESHAN, Surendra",61/100595 | 12/425046,US | US,2008-09-26 | 2009-04-16,,,,,AU2009296472A1 | BRPI0919115A2 | CA2738497A1 | US2010-0082466A1 | US2010-0082467A1 | US61/100595 | WOWO2010-036863A2,7,,,,6010026003603,"['new beneficiary initiated p2p', 'p2b payment model']","['electronic form detailing', 'suitable payment means', 'payee receive funds', 'request payment', 'payment request', 'without requiring', 'specific account', 'infrastructure investment', 'credit card', 'account specified', 'invoice using', 'system allows', 'receive', 'payee', 'funds', 'system', 'invoice', 'allows', 'require', 'payor', 'pay', 'part', 'method', 'issue', 'finally', 'disclosed', 'associated']"
JP,JP,P,A ,A P2P resource loan support method and a system,"[ABSTRACT] [Technical problem] A resource request person searches the optimal resource donor with P2P matching in respect of the conditions of a schedule, a quality of service, and others, and a resource donor also supports the loan of the reasonable resource which can disclose an offer resource. [Means for Solution]A schedule in which a volunteer given in schedule book 5 of a volunteer purveyor of service is possible is changed into volunteer service offer filter information (semantic information) with a schedule book / filter conversion device 6, and is set as the semantic information network 2 as a filter. The filter 7 is set up as a reception function of the volunteer purveyor-of-service terminal 3. The volunteer service request person terminal 4 sends out a volunteer purveyor-of-service search event to the semantic information network 2. If the filter 7 ignites in the event, the terminal 3 will carry out autonomous starting and will transmit the data of a possible schedule to the terminal 4. A remote volunteer etc. will be performed if matching is materialized between the terminal 3 and the terminal 4. [Chosen drawing] figure 1 ","[Claim1]When the event which is the packet which was installed in each terminal on IP communications network and IP communications network, and gave semantic information to the header is received, The semantic information network to which semantic information is transmitted according to routing table information with the filter which is the semantic information currently held inside, In the system which has a volunteer purveyor-of-service terminal, a volunteer service request person terminal, a schedule book, and a schedule book / filter conversion device, The step which changes into volunteer service offer filter information the schedule book which indicated the schedule in which volunteer of a volunteer purveyor of service is possible with the above-mentioned schedule book / filter conversion device, The step which sets the volunteer service offer filter information as the above-mentioned semantic information network and the above-mentioned volunteer purveyor-of-service terminal as a filter, The step at which the above-mentioned volunteer service request person terminal sends out a volunteer purveyor-of-service search event to the above-mentioned semantic information network, and the step to which the above-mentioned filter ignites in the event, A P2P resource loan support method which has a step which the above-mentioned volunteer purveyor-of-service terminal of connection with the above-mentioned filter carries out autonomous starting, and transmits the data of the schedule in which the volunteer is possible to the volunteer service request person terminal.",12.0,2003-159160,2003-06-04,2004-362214,2004-12-24,,,NIPPON TELEGR & TELEPH CORP <NTT>,上田  清志 | 岩田  哲弥,,,,0.0,,0.0,,JP2004-362214A,1,Withdrawn,,,2204050004714,"['p2p resource loan support method', 'system']","['volunteer service request person terminal 4 sends', 'resource request person searches', 'volunteer service offer filter information', 'filter conversion device 6', 'semantic information network 2', 'resource donor also supports', 'service terminal 3', 'remote volunteer etc', 'optimal resource donor', 'service search event', 'filter 7 ignites', 'terminal 4', 'schedule book 5', 'semantic information', 'offer resource', 'terminal 3', 'volunteer purveyor', 'volunteer given', 'filter 7', 'reasonable resource', 'schedule book', 'technical problem', 'reception function', 'figure 1', 'chosen drawing', 'autonomous starting', 'service', 'possible schedule', 'p2p matching', 'filter', 'schedule', 'event', 'possible', 'matching', 'transmit', 'solution', 'set', 'respect', 'quality', 'performed', 'others', 'means', 'materialized', 'loan', 'disclose', 'data', 'conditions', 'changed', 'carry', 'abstract']"
