KR,KR,P,B1,"Method, Apparatus and Computer-Readable Medium for P2P loan service using used car.(중고 자동차를 이용한 피투피 대출 서비스 제공 방법, 서버 및 컴퓨터-판독가능 매체)","The present invention relates to a technique for providing a peer to peer (P2P) loan service using a used car, which calculates a mortgage value of a used car according to a transaction price of the used car, proceeds a P2P loan by using the used car as collateral, and provides a reasonable P2P loan service according to the value of the used car without disclosing and calculating a credit rating of a user who wants to receive the loan in the P2P loan service, thereby protecting individual information of an investor who provides the loan and a consumer who uses the loan, and increasing reliability of the loan service. A method for providing a P2P loan service using a used car comprises: a loan information calculating step; a loan information exposing step; and a loan processing step.","It is the peer-to-peer loan service providing method taking the second-hand car implemented as the computing device for including one or more processors and one or more memories storing executable commands in the processor. The amount of money corresponding the loan permit signal and loan amount information to the loan amount of each second user from the terminal of one or more second user and the loan information production step: loan information exposure step: providing the calculated used car mortgage value information as described above to the terminal of the multiple second users which is the investor to provide the loan between the individual through the online in the reception through the loan contract process from the finance account of one or more second user with the finance account of the first user processes descriptive data of the vehicle which the first user for to getting a loan of money holds and produces the used car mortgage value and loan interest the amount of money is transferred to. The loan processing level setting up the used car as security is included. The interest stage of change which changes the loan interest by using the driving breakdown information of the vehicle at the set cycle further is included after the performance of the loan processing level. The interest stage of change, is the car maintenance to the performance point of the interest stage of change performance point of the just before and current interest stage of change and accident handling breakdown information, and the interest is changed by using the driving distance information are included. The vehicles information abstraction stage that the loan information production step extracts descriptive data of the vehicle, data collection stage using descriptive data extracted from the vehicles information abstraction stage and collects market data of the vehicles matched for descriptive data from the outer server, the enterprise quotation production step, the trade price determining step applying the quotation of the second hand article *** standards to the set correction algorithm and sets the trade price of the vehicle, and the final loan information production step multiplying the trade price calculated with the trade price determining step by the set damping ratio and produces the used car mortgage value are included. The data collection stage applies the different priority market data of vehicles in the collection according to descriptive data of the vehicle. The vehicles information abstraction stage that the loan information production step extracts descriptive data of the vehicle the first user possesses. As to data collection stage, the vehicle market price information of one or more second hand article ***s is registered. The enterprise quotation production step turns out the quotation of the second hand article *** standards about the vehicle by using market data collected by data collection stage. The peer-to-peer loan service providing method taking the second-hand car wherein market data of the vehicles of the set number is collected to the quotation data order of the vehicles matched for the descriptive data with high priority. ",9.0,10-2016-0175349,2016-12-21,10-2018-0072117,2018-06-29,10-1878282,2018-07-09,1000under,Kim Sung Kuk,,,,5.0,JP2008-065474A(BE) | JP2002-183444A(BE) | KR10-1675820B1(BE) | KR10-1665408B1(BE) | KR10-2003-0040715A(BE),0.0,,KR10-1878282B1,1,Granted,,천언더 주식회사,3518292000852,"['중고 자동차를 이용한 피투피 대출 서비스 제공 방법', 'p2p loan service using used car', '서버 및 컴퓨터', '판독가능 매체', 'readable medium', 'method', 'computer', 'apparatus']","['reasonable p2p loan service according', 'thereby protecting individual information', 'loan information exposing step', 'used car without disclosing', 'loan information calculating step', 'p2p loan service using', 'used car according', 'loan processing step', 'p2p loan service', 'loan service using', 'used car comprises', 'present invention relates', 'loan service', 'p2p loan', 'used car', 'transaction price', 'increasing reliability', 'credit rating', 'mortgage value', 'loan', 'p2p', 'using', 'calculating', 'value', 'wants', 'uses', 'user', 'technique', 'receive', 'providing', 'provides', 'proceeds', 'peer', 'method', 'investor', 'consumer', 'collateral', 'calculates']"
KR,KR,P,A,P2P loan service system of online personal bank to provide the cloud funding function from a number of investors(투자자들의 크라우드 펀딩 기능을 제공하는 온라인 개인 은행의 Ｐ２Ｐ 대출 서비스 시스템)," The invention relates to the P2P system for loan service and method of the online private bank providing the crowd funding function of the investors. And the online private bank which provides the P2P loan service by using PC, and the application of the Smart phone or the tablet PC is opened. It induces investment to the media public relation, the website marketing, and the multiple investors holding the example / reddish copper-gold alloy, the stocks, the real estate, bond through the blog marketing through the crowd funding after the investment creation of a contract so that the online private bank accumulates the investing amount of the investors in the pin tech market and the P2P loan be made to the loan applicant. The online private bank or the investor of the online private bank drops the direct loan decision making from investors based on the accumulated investment through the credit evaluation and judgment on loan to the loan applicant and the online private bank or the investor pays the loan amount on account to the direct loan applicant after the loan creation of a contract. These information are under the online private bank control. And the investor receives the capital about the loan amount of the lender to the loan the expiration date in the interest according to the interest and loan arrival of the due date through the online private bank The profit of the online private bank which provides the principal guarantee insurance service guaranteeing the capital of the investors to the online private bank in the crowd funding of the investors and providing the P2P loan service and in which the individual of the enterprise of the individual provides the P2P loan service to the enterprise to the individual to the individual is created. ","The cash investment contract document after the user authentication after the join to the multiple investors which is connected to the investor terminal: manager PC which invests the join, investment creation of a contract, cash, stocks, real estate by using PC, and the application of the Smart phone or the tablet PC and recruits investors in the pin tech market through the media public relation, advertisement, blog marketing, website and accumulates the investing amount of the investors through the crowd funding and holds the example / reddish copper-gold alloy, and the real estate through wired and wireless network. The real estate investment contract document and notarization document of building, housing, land, forests and fields the attraction of investment are received after the preparation and this is accumulated to cash or the investing amount of the investors is accumulated and the loan application is registered from the multiple loan applicants and enterprise valuation, the credit evaluation of the individuals, the online individual bank server providing the P2P loan service in the loan to the loan applicant recognized after the voice recording and judgment on loan, the investment transactions and the certificate server authenticating the lending transaction transaction is connected to the online individual bank server, and the lender terminal are included. The online individual bank server further includes the investment contract document it is connected to the controller, and the encoding / decoder this is decoded and the permitted administrator refers it is encrypted and it is stored it is hashed through the electronics fingerprint and in order to prevent the forgery of the loan contract document. The lender terminal makes the loan contract document in order to receive the P2P loan amount from one or more investor through the online individual bank server through the loan application form write down, the authentication of the certificate server, and the credit evaluation and judgment on loan with the direct lender and transmits to the online private bank. A part of the investing amount in which the P2P system for loan service of the online private bank further includes the administrator and the permitted loan applicant of the online private bank, and loan application query data with the lender or the chatting server sending and receives interest payment money query data and one investor provides the P2P loan service for the direct lender through the online individual bank server in the deposited amount of money or the different investors are already accumulated to the auction bid mode. And the invested amount of money is added up and the loan amount of the lender is raised. And the investing amount is determined as the auction bid mode of the investors of the inside and the loan is made. And the investor receives the interest corresponding to the amount of money which oneself invests in the investment creation of a contract according to the fixed the interest. And the investor can invest in the online private bank in the instead of cash in the real estate. And it is determined if it has the case where the investor invests the real estate of the building, housing, the land, forests and fields, and the specified period days of respite and the relevant real estate is received through the field real image and real estate valuation The administrator and the permitted loan applicant of the online private bank provides the P2P loan service it sends and receives the administrator and permitted investment consultation data of the online private bank providing the P2P loan service through the multiple investors and crowd funding. The U.S. - Korea service, the Japanese - Korea service, and the P2P system for loan service providing the China - Korea service of the online private bank the online individual bank server providing the P2P loan service through the crowd funding builds community and contents according to by country language to the language of every country it opens the oversea P2P loan service the crowd funding function of the investors is provided wherein it is low assigned in consideration of the purchasing price of the purchase point of time of the real estate of the investor and depreciation than the purchasing price of the purchase point of time of the relevant real estate of the investor ; the investing amount is assigned as actual the real estate trade price striking the compound ratio a balance after the schedule duration lapse ; and the direct loan amount is paid on account to the loan applicant in which the loan is admitted through the online private bank in which one or more investor provides the P2P loan service through the crowd funding and it loans and it has the capital refunded in the interest repayment and loan period expiration.",5.0,10-2018-0073777,2018-06-27,10-2018-0074650,2018-07-03,,,Lee Yeo Song,Lee Yeo Song,,,,0.0,,0.0,,KR10-2017-0132500A | KR10-2018-0074650A,2,Pending,,,3518271002237,"['투자자들의 크라우드 펀딩 기능을 제공하는 온라인 개인 은행의 ｐ２ｐ 대출 서비스 시스템', 'p2p loan service system', 'online personal bank', 'cloud funding function', 'provide', 'number', 'investors']","['principal guarantee insurance service guaranteeing', 'online private bank drops', 'online private bank control', 'online private bank accumulates', 'online private bank providing', 'direct loan decision making', 'online private bank', 'pin tech market', 'media public relation', 'direct loan applicant', 'multiple investors holding', 'crowd funding function', 'p2p loan service', 'loan service', 'crowd funding', 'loan applicant', 'p2p loan', 'p2p system', 'loan creation', 'loan arrival', 'loan amount', 'website marketing', 'using pc', 'tablet pc', 'smart phone', 'reddish copper', 'real estate', 'investors based', 'investment creation', 'investing amount', 'invention relates', 'induces investment', 'gold alloy', 'expiration date', 'due date', 'credit evaluation', 'blog marketing', 'accumulated investment', 'investor receives', 'investor pays', 'interest according', 'individual provides', 'providing', 'loan', 'investors', 'investor', 'provides', 'interest', 'individual', 'stocks', 'profit', 'opened', 'method', 'made', 'lender', 'judgment', 'information', 'example', 'enterprise', 'created', 'contract', 'capital', 'bond', 'application', 'account']"
KR,KR,P,A,"Method, Apparatus and Computer-Readable Medium for P2P loan service using used car.(중고 자동차를 이용한 피투피 대출 서비스 제공 방법, 서버 및 컴퓨터-판독가능 매체)","The present invention relates to a technique for providing a peer to peer (P2P) loan service using a used car, which calculates a mortgage value of a used car according to a transaction price of the used car, proceeds a P2P loan by using the used car as collateral, and provides a reasonable P2P loan service according to the value of the used car without disclosing and calculating a credit rating of a user who wants to receive the loan in the P2P loan service, thereby protecting individual information of an investor who provides the loan and a consumer who uses the loan, and increasing reliability of the loan service. A method for providing a P2P loan service using a used car comprises: a loan information calculating step; a loan information exposing step; and a loan processing step.","The peer-to-peer loan service providing method that takes the second-hand car, peer-to-peer loan service providing method comprising: the loan processing level which is the peer-to-peer loan service providing method taking the second-hand car implemented as the computing device for including one or more processors and one or more memories storing executable commands in the processor ; it transfers the amount of money corresponding the loan permit signal and loan amount information to the loan amount of each second user from the terminal of one or more second user and the loan information production step: loan information exposure step: providing the calculated used car mortgage value information as described above to the terminal of the multiple second users to provide the loan in the reception through the loan contract process from the finance account of one or more second user with the finance account of the first user processes descriptive data of the vehicle which the first user for to getting a loan of money holds and produces the used car mortgage value and loan interest to the amount of money ; and sets up the used car as security. ",13.0,10-2016-0175349,2016-12-21,10-2018-0072117,2018-06-29,,,1000under,Kim Sung Kuk,,,,5.0,JP2008-065474A(BE) | JP2002-183444A(BE) | KR10-1675820B1(BE) | KR10-1665408B1(BE) | KR10-2003-0040715A(BE),0.0,,KR10-1878282B1,1,Granted,,,3518271000125,"['중고 자동차를 이용한 피투피 대출 서비스 제공 방법', 'p2p loan service using used car', '서버 및 컴퓨터', '판독가능 매체', 'readable medium', 'method', 'computer', 'apparatus']","['reasonable p2p loan service according', 'thereby protecting individual information', 'loan information exposing step', 'used car without disclosing', 'loan information calculating step', 'p2p loan service using', 'used car according', 'loan processing step', 'p2p loan service', 'loan service using', 'used car comprises', 'present invention relates', 'loan service', 'p2p loan', 'used car', 'transaction price', 'increasing reliability', 'credit rating', 'mortgage value', 'loan', 'p2p', 'using', 'calculating', 'value', 'wants', 'uses', 'user', 'technique', 'receive', 'providing', 'provides', 'proceeds', 'peer', 'method', 'investor', 'consumer', 'collateral', 'calculates']"
KR,KR,P,B1,Mediation service system of Stock Secured Loan System based on P2P and management method threrof(P2P 기반 주식담보대출 중개서비스 시스템 및 이의 운용방법),"The present invention relates to a mediation service system of a stock secured loan system based on p2p and a management method thereof. Since a financial server can execute a loan on security of an investment and a stock, safety for payback is secured and a loan limit and utilization are increased. A brokerage management server uses a P2P program to expose investment-related information including the possible loan amount of an applicant to an online site. So, investors and investment amounts for this can be collected. Therefore, it is possible to quickly and easily collect investment amounts and expend investor choices at the same time. The mediation service system includes a loan client; a financial service server; a mediation server; and investment clients.","Application information possessing the stocks and include the loan client applying the loan for the stocks to security, the banking facility server providing the mortgage lending service, and the individual personal information from the loan client and security holdings related information are input and the stocks mortgage lending is registered. And the application information of the loan client is transmitted with the banking facility server and the loanable amount passing of examination data that the examination was passed is transmitted from the banking facility server, and the broker management server is the investment gathering unit the banking facility server executes the banking facility loan to the loan client it is the security holdings of the loan client and the investing amount received the remittance to the double security it receives the investing amount from the broker management server with remittance the investing amount received the remittance is remitted to the account of the banking facility server. The investment the investing amount corresponding to the loanable amount is received among investment clients from the desired investment clients with remittance and it provides for investment clients producing the graphic user interface (GUI, Graphic User Interface) are included. The broker management server further includes the loanable amount passing of examination data that the examination was passed is transmitted from the banking facility server, and the broker management server is the investment gathering unit the banking facility server executes the banking facility loan to the loan client it is the security holdings of the loan client and the investing amount received the remittance to the double security it receives the investing amount from the broker management server with remittance the investing amount received the remittance is remitted to the account of the banking facility server. The investment the investing amount corresponding to the loanable amount is received among investment clients from the desired investment clients with remittance and it provides for investment clients producing the graphic user interface (GUI, Graphic User Interface). As to the broker management server is the investment, the security holdings related information is displayed and are connected and The investment gathering unit comprises the interface processing module provided for investment clients producing the investment recruitment interface which is the graphic user interface (GUI, Graphic User Interface) in which the loanable amount, and the security holdings related information are displayed and are connected; the accumulative investment amount of money output module which if is requested for the investment application including the investment possibility amount of money from any one of investment clients it adds up the requested investment possibility amount of money in the accumulative investment amount of money initiated in the initial `0` and turns out the accumulative investment amount of money; the loanable amount of the corresponding loan case the accumulative investment amount of money calculated with the accumulative investment amount of money output module; and the compare module: investment application receipt module: investment recruitment terminate module which determines because the investor invitation was completed by the compare module if the accumulative investment amount of money was identical with the loanable amount and controls the interface processing module so that the information of the corresponding loan case be expunged in the investment recruitment interface registers the investment application the accumulative investment amount of money is the loanable amount or less with the compare module compares the accumulative investment amount of money is the loanable amount or less it compares The stocks mortgage lending dealing services system, wherein the interface processing module the investment application receipt module receives the investment application ; and the investment recruitment interface is renewed so that the accumulative investment amount of money about the corresponding loan case be displayed.",4.0,10-2016-0088438,2016-07-13,10-2018-0007439,2018-01-23,10-1853758,2018-04-25,"DANBI LOAN CO.,LTD",PARK Dong-Won | JEONG Tae-Bok | KANG Young-Cheol | LEE Seung-Wook,,,,3.0,KR10-2015-0112384A(BE) | KR10-1440464B1(BE) | KR10-2004-0084346A(BE),0.0,,KR10-1853758B1,1,Granted,,(주)단비대부,3518184000350,"['p2p 기반 주식담보대출 중개서비스 시스템 및 이의 운용방법', 'stock secured loan system based', 'mediation service system', 'management method threrof', 'p2p']","['stock secured loan system based', 'mediation service system includes', 'brokerage management server uses', 'easily collect investment amounts', 'mediation service system', 'management method thereof', 'related information including', 'present invention relates', 'expend investor choices', 'financial service server', 'possible loan amount', 'mediation server', 'financial server', 'investment amounts', 'loan limit', 'loan client', 'investment clients', 'expose investment', 'online site', 'p2p program', 'stock', 'secured', 'loan', 'investment', 'possible', 'p2p', 'utilization', 'time', 'therefore', 'since', 'security', 'safety', 'quickly', 'payback', 'investors', 'increased', 'execute', 'collected', 'applicant']"
